File_Name,Regulating_Ecosystem_Services,Regulating_Ecosystem_Services_Detail,Cultural_Ecosystem_Services,Cultural_Ecosystem_Services_Detail,Provisioning_Ecosystem_Services,Provisioning_Ecosystem_Services_Detail,Health_and_Wellbeing,Health_and_Wellbeing_Detail,Social_and_Community_Outcomes,Social_and_Community_Outcomes_Detail,Economic_Outcomes,Economic_Outcomes_Detail
ziemelniece2023.pdf,"['Climate regulation', 'Flood regulation/stormwater management']","The study analyzes climate regulation and stormwater management as outcomes of greenspace quality. In the Methods section, the criteria used to assess residential areas include how a ""green structure reduces summer temperatures"" (climate regulation) and reduces ""stormwater management costs"" (flood regulation). The Results section analyzes the high-quality Helsinki residential area, noting that ""extensive rainwater harvesting areas, canals and small ditches are created"" and highlights the ""Linking green fabric with stormwater solutions,"" demonstrating that stormwater management is an analyzed outcome of the greenspace design.","['Aesthetic', 'Recreational']","The study's primary focus is on aesthetic and recreational outcomes of residential courtyard quality. 
Aesthetic: The research is explicitly for the ""visual aesthetic quality"" of residential areas. The Methods section states the research is a ""comparative, considering the visual aesthetic quality of existing courtyards"". The Results section analyzes the poor-quality Jelgava courtyard as creating a ""chaotic, unpleasant and dangerous feeling"" and contrasts this with the ""pleasant environment"" of the high-quality Helsinki site.
Recreational: The study analyzes recreational opportunities as an outcome of courtyard quality. The Methods section includes ""Lifestyle enhancement – walking trails, play and recreation areas for all age groups"" as an assessment criterion. The Results section contrasts the ""poor condition of resting places"" in Jelgava with the Helsinki site, where ""green spaces to be created for people to walk and relax"" and there are ""children's play areas"".",['Food'],"The study analyzes the potential for food provision as an outcome of greenspace design. The Methods section lists ""fruit trees, berry bushes"" as potential landscaping elements in a courtyard. The Results section presents the Helsinki case study as a positive example of high-quality design, featuring ""urban gardens for social activities"" (Fig. 10), which are analyzed as a component of a well-designed, multifunctional greenspace.","['Physiological health', 'Psychological health']","The study analyzes both physiological and psychological health as outcomes of courtyard quality.
Physiological health: The Methods section lists criteria for assessment that include ""promoting a healthy, active lifestyle"" and ""Health benefits – public outdoor spaces provide walking and cycling opportunities for everyone"". The analysis contrasts the ""unsafe environment"" in Jelgava with the opportunities to ""walk and relax"" in the well-designed Helsinki courtyards.
Psychological health: The Methods section includes assessment criteria such as ""Raising residents' self-esteem"", creating ""Peace and relaxation"", and providing ""Stress relief through visual qualities"". The Results section analyzes the negative psychological impact of the poor-quality Jelgava courtyard, noting it creates an ""unpleasant and dangerous feeling"".","['Use, engagement, recreation', 'Social interaction, cohesion', 'Stewardship, education']","The study analyzes several social outcomes as consequences of courtyard quality.
Use, engagement, recreation: The study analyzes how courtyard quality affects its use. The Results describe the Jelgava courtyard as having ""unfavourable conditions"" and being ""dangerous for all users of the outdoor space,"" which implies discouraged use. This is contrasted with the Helsinki courtyard, which is analyzed as providing a ""diverse, sustainable living space for residents,"" encouraging use.
Social interaction, cohesion: The Methods section lists criteria for ""Strengthening society,"" such as creating an ""organised community structure"" and a ""shared environment where different generations come together."" The Results analyze features in the Helsinki example like ""urban gardens for social activities"" and ""semi-private meeting places"" that foster social interaction. The conclusion states that a well-planned area contributes to ""positive social communication"".
Stewardship, education: The study analyzes stewardship through resident action. The Results section notes that in the poor-quality Jelgava site, ""residents have made their own beds of ornamental greenery, which is a signal of the need for order and development,"" analyzing an act of stewardship.",['Property value growth/capitalization'],"The study analyzes property value as an economic outcome of courtyard quality. In the Methods section, ""Property appreciation"" is listed as a criterion under ""Balancing economic issues"" that is used to assess and compare the residential areas. The conclusion reinforces this by stating that a ""carefully planned courtyard area... [makes a] contribution to... the creation of economic values of the city."""
cheng2020.pdf,[],"No relevant outcome information was identified. The study's objective is to explore the link between fiscal arrangements and the quality of public services, specifically urban park systems. In its analysis, 'the quality of urban park systems' is the dependent variable, measured through indicators such as public access to parks, per-capita provision of playgrounds, the percentage of parkland, and a composite 'Park Score Index'. The study analyzes how fiscal arrangements (the independent variable) are associated with these measures of park quality. It does not analyze or measure any subsequent outcomes or consequences of park quality, such as its effects on ecosystem services, health, social dynamics, or economic values. The measured variables are indicators of park quality, not outcomes resulting from it.",[],"No relevant outcome information was identified. The study's objective is to explore the link between fiscal arrangements and the quality of public services, specifically urban park systems. In its analysis, 'the quality of urban park systems' is the dependent variable, measured through indicators such as public access to parks, per-capita provision of playgrounds, the percentage of parkland, and a composite 'Park Score Index'. The study analyzes how fiscal arrangements (the independent variable) are associated with these measures of park quality. It does not analyze or measure any subsequent outcomes or consequences of park quality, such as its effects on ecosystem services, health, social dynamics, or economic values. The measured variables are indicators of park quality, not outcomes resulting from it.",[],"No relevant outcome information was identified. The study's objective is to explore the link between fiscal arrangements and the quality of public services, specifically urban park systems. In its analysis, 'the quality of urban park systems' is the dependent variable, measured through indicators such as public access to parks, per-capita provision of playgrounds, the percentage of parkland, and a composite 'Park Score Index'. The study analyzes how fiscal arrangements (the independent variable) are associated with these measures of park quality. It does not analyze or measure any subsequent outcomes or consequences of park quality, such as its effects on ecosystem services, health, social dynamics, or economic values. The measured variables are indicators of park quality, not outcomes resulting from it.",[],"No relevant outcome information was identified. The study's objective is to explore the link between fiscal arrangements and the quality of public services, specifically urban park systems. In its analysis, 'the quality of urban park systems' is the dependent variable, measured through indicators such as public access to parks, per-capita provision of playgrounds, the percentage of parkland, and a composite 'Park Score Index'. The study analyzes how fiscal arrangements (the independent variable) are associated with these measures of park quality. It does not analyze or measure any subsequent outcomes or consequences of park quality, such as its effects on ecosystem services, health, social dynamics, or economic values. The measured variables are indicators of park quality, not outcomes resulting from it.",[],"No relevant outcome information was identified. The study's objective is to explore the link between fiscal arrangements and the quality of public services, specifically urban park systems. In its analysis, 'the quality of urban park systems' is the dependent variable, measured through indicators such as public access to parks, per-capita provision of playgrounds, the percentage of parkland, and a composite 'Park Score Index'. The study analyzes how fiscal arrangements (the independent variable) are associated with these measures of park quality. It does not analyze or measure any subsequent outcomes or consequences of park quality, such as its effects on ecosystem services, health, social dynamics, or economic values. The measured variables are indicators of park quality, not outcomes resulting from it.",[],"No relevant outcome information was identified. The study's objective is to explore the link between fiscal arrangements and the quality of public services, specifically urban park systems. In its analysis, 'the quality of urban park systems' is the dependent variable, measured through indicators such as public access to parks, per-capita provision of playgrounds, the percentage of parkland, and a composite 'Park Score Index'. The study analyzes how fiscal arrangements (the independent variable) are associated with these measures of park quality. It does not analyze or measure any subsequent outcomes or consequences of park quality, such as its effects on ecosystem services, health, social dynamics, or economic values. The measured variables are indicators of park quality, not outcomes resulting from it."
ward2023.pdf,['Habitat provision'],"The study analyzed participants' perceptions of positive elements of greenspaces, which included the enjoyment of seeing plants and wildlife. This was linked to greenspace quality, as participants discussed how management choices, such as creating 'space for nature' by leaving patches of wildflowers or trees, resulted in the presence of wildlife like ""dragonflies, butterflies"". Participants explicitly linked these ""natural elements"" with a ""perceived benefit for their mental health"" (Section 3.3).","['Aesthetic', 'Recreational']","Aesthetic: In the results (Section 3.3), participants identified positive elements of greenspaces that contributed to their well-being, including ""open spaces that were desirable from an aesthetic perspective"" and the experience of ""Water and beauty"".
Recreational: The study analyzed how greenspace quality influenced recreational use. Negative quality elements, such as anti-social behaviors, litter, and lack of maintenance, were reported as barriers that ""stopped some participants from visiting or visiting as often as they would like"" (Section 3.4). Conversely, positive qualities encouraged recreational activities like walking and exercise, which were linked to physical health benefits (Section 3.2).",[],No provisioning ecosystem services were explicitly analyzed or measured as outcomes of park or greenspace quality in the Methods or Results sections.,"['Physiological health', 'Psychological health']","The study's results in Section 3.2, ""How spending time in greenspaces contributes to perceived well-being,"" directly analyze these outcomes based on participant interviews. 
Physiological health: This was analyzed through participant reports of benefits ""linked to exercising, such as walking or participants generally being more active in greenspaces than they would be in other environments."" One participant was quoted as saying, ""physically, in terms of the exercise, it has really helped.""
Psychological health: This was analyzed through the theme of ""cognitive restoration,"" which included reported ""mental health benefits, including visiting greenspace to facilitate the alleviation of stress"" and replenished mental capacity. Participants described the experience as ""very relaxing,"" a ""proper break from work,"" and a time when they felt their ""brain was calm.""","['Use, engagement, recreation', 'Social interaction, cohesion', 'Equity, environmental justice']","Use, engagement, recreation: The study analyzed how negative elements of greenspace quality, such as ""anti-social and undesirable behaviours,"" litter, and lack of maintenance, acted as ""barriers that stopped some participants from visiting or visiting as often as they would like"" (Section 3.4), directly linking perceived quality to levels of use.
Social interaction, cohesion: In Section 3.2, ""social interaction"" was identified as a key theme for how greenspaces contribute to well-being. The analysis showed participants valued greenspaces ""for socialising with others and preventing isolation,"" including both planned interactions with friends and family and incidental interactions with strangers.
Equity, environmental justice: The results demonstrate that the outcomes of greenspace quality are not equitable. The study found that ""negative elements were more frequently referred to by participants receiving benefits and participants living in more deprived areas"" (Section 3.4). Furthermore, it analyzed ""representational barriers,"" where ethnic minority participants reported feeling ""unwelcome and uncomfortable due to experiencing racism and harassment in greenspaces"" (Section 3.1), an outcome related to the social environment of the park.",[],No economic outcomes were explicitly analyzed or measured as outcomes of park or greenspace quality in the Methods or Results sections of this study.
roe2016.pdf,[],"No relevant outcome information was identified. The study did not measure or analyze any regulating ecosystem services such as climate regulation, flood management, or air purification as outcomes of greenspace quality.",[],"No relevant outcome information was identified. The study measured perceptions of greenspace attractiveness and patterns of recreational use, but these were treated as indicators of greenspace quality or as predictors of health outcomes, not as outcomes of greenspace quality themselves.",[],No relevant outcome information was identified. The study did not measure or analyze any provisioning ecosystem services such as food or fresh water production.,['Psychological health'],"The study's primary outcome measure was self-rated 'General Health,' a measure of subjective well-being. This was measured using a single-item, 5-category Likert scale from 1 (very good health) to 5 (very poor health). The study used Correlated Component Regression (CCR) to analyze predictors of general health for three distinct ethnic health segments. For the 'Mixed BME' group (described as having the 'worst health'), perceptions of greenspace quality, specifically 'GS Satisfaction' and 'GS Safety,' were identified as significant predictors of general health. The results showed that 'Higher GS satisfaction' and 'Higher GS safety' were associated with better health in this group (Table 3, page 11; page 12).",[],"No relevant outcome information was identified. The study measured social variables such as neighborhood trust, place belonging, and social patterns of greenspace use. However, these were analyzed as predictors of health, not as outcomes resulting from greenspace quality.",[],No relevant outcome information was identified. The study did not measure or analyze any economic outcomes related to greenspace quality.
cengiz2012.pdf,[],"No regulating ecosystem services were explicitly analyzed or measured as outcomes of park or greenspace quality. Although Table 4 lists 'Effect on urban climate' as a criterion for ecological quality, this was not measured or analyzed in the Results section. The study's evaluation of ecological quality focused on assessing vegetation diversity and condition as indicators of quality, not on measuring regulatory outcomes.","['Aesthetic', 'Recreational']","The study analyzed cultural ecosystem services as outcomes of urban public green space (UPGS) quality through a survey of 150 users. Recreational outcomes were measured by evaluating user preferences for different 'use-activities' such as sitting areas, playgrounds, and walking tracks (Table 6, Fig. 2). Aesthetic outcomes were measured by asking users to rate the 'comfort and image' of the parks, which included the sub-headings 'vegetation' and 'attractiveness' (Fig. 2). The results present percentage ratings of user preferences for these recreational and aesthetic qualities across five different parks.",[],No provisioning ecosystem services were analyzed or measured as outcomes of park or greenspace quality in the Methods or Results sections.,[],"No health and well-being outcomes were analyzed or measured as outcomes of park or greenspace quality. While the study measured recreational activities, it did not measure any resulting physiological or psychological health effects.","['Use, engagement, recreation', 'Social interaction, cohesion', 'Equity, environmental justice']","The study analyzed social and community outcomes through user surveys and behavior mapping. 'Use, engagement, recreation' was a central outcome, measured via survey questions on preferred activities (Table 6) and direct observation of user behavior in the parks (Table 7). 'Social interaction, cohesion' was measured as an outcome through the survey criterion of 'sociability,' which included 'socializing' and 'evening use' (Fig. 2). The results show user ratings for each park on these dimensions. 'Equity, environmental justice' was addressed by analyzing user perceptions of park 'accessibility,' specifically including 'accessible for the disabled' as a measured criterion in the survey (Fig. 2).",[],"No economic outcomes were analyzed or measured as outcomes of park or greenspace quality. Although 'Economic quality' was assessed by experts (Table 8), this was treated as a component of overall environmental quality, focusing on internal economic functions like the presence of tea houses or kiosks, rather than as a measured outcome like property value changes or tourism impacts."
southon2017.pdf,[],"No regulating ecosystem services were measured as outcomes. The study provided information on biodiversity benefits (e.g., abundance of bees and butterflies) to assess its influence on participants' tolerance for meadow appearance, but did not measure changes in biodiversity, climate regulation, or other RES as a dependent variable resulting from greenspace quality.",['Aesthetic'],"The study directly measures aesthetic outcomes of different meadow planting styles, which represent a dimension of greenspace quality. In Phase 1, a photo elicitation study was used to assess ""site users' preference for meadow style plantings relative to other planting styles"" using a 1-10 preference score (Section 2.4). The results show that ""meadow images received higher preference scores than images of herbaceous and formal bedding styles"" (Section 3.1). In Phase 2, the study assessed how ""plant species richness and structural diversity were associated with respondents' preference scores (an indicator of aesthetic value)"" for experimentally created meadow plots, again using a 1-10 preference score (Section 2.5). The results show that ""all of the meadow treatments had higher preference scores than the replicate standard mown amenity grass treatment"" and that ""Preference scores increased with plant species richness"" (Section 3.3). The study also measured respondents' ""willingness to tolerate the current appearance of each plot"" outside the flowering season as an aesthetic outcome (Section 2.5, 3.4).",[],No provisioning ecosystem services were measured or analyzed as outcomes of greenspace quality in the study.,[],No health and well-being outcomes were measured or analyzed as outcomes of greenspace quality in the study.,['Other'],"The study analyzed perceptions of site quality and site appreciation as outcomes of meadow creation. Under the 'Other' category, the specific outcomes are 'perceived site quality' and 'site appreciation'. In the Methods (Section 2.4), researchers asked respondents at experimental (meadow) and control sites, ""'Do you feel that the site has changed in quality over the last year?' (scored on a five point Likert scale...)"" and ""'Has this change altered your appreciation of the site?' (scored on a five-point Likert scale...)"". The Results (Section 3.2) show that ""Respondents were significantly more likely to report positive changes in site quality at sites where experimental meadow treatments were introduced than at control sites"". Furthermore, the study found that 65% of respondents who cited the meadows as a reason for site quality changes ""stated that the meadows had improved their appreciation of the site"".",[],"No economic outcomes were measured as outcomes of greenspace quality. The study used information on potential cost savings from reduced mowing to assess its influence on participants' tolerance for meadow appearance, but did not measure actual cost savings or other economic benefits as a dependent variable."
mceachan2018.pdf,[],No relevant outcome information was identified. The study did not analyze or measure any regulating ecosystem services as outcomes of park or greenspace quality.,[],"No relevant outcome information was identified. While the study measured 'use of' green space, it was treated as an independent variable in regression models predicting mental wellbeing, not as a dependent outcome of greenspace quality.",[],No relevant outcome information was identified. The study did not analyze or measure any provisioning ecosystem services as outcomes of park or greenspace quality.,['Psychological health'],"The study's primary outcome was children's mental wellbeing, a measure of psychological health. The Methods section states: 'The primary outcome was parent-reported mental wellbeing for children aged 4 years, assessed with the standardised Strengths and Difficulties Questionnaire (SDQ). Total, internalising, and externalising behavioural difficulties and prosocial behaviour scales were computed'. The study used multiple regression to analyze the association between greenspace availability (NDVI) and quality (satisfaction with local green spaces) and these mental wellbeing outcomes. The Results section reports that among South Asian children, 'more green space was associated with fewer internalising behavioural difficulties... and with fewer total behavioural difficulties', and that 'satisfaction with green space was significantly associated with fewer total behavioural difficulties..., fewer internalising behavioural difficulties..., and greater prosocial behaviour'.",[],"No relevant outcome information was identified. The study did not analyze or measure social or community outcomes, such as social cohesion or equity, as dependent variables resulting from park or greenspace quality. While moderation by ethnicity was explored, the outcome remained mental health.",[],No relevant outcome information was identified. The study did not analyze or measure any economic outcomes of park or greenspace quality.
