File_Name,Regulating_Ecosystem_Services,Regulating_Ecosystem_Services_Detail,Cultural_Ecosystem_Services,Cultural_Ecosystem_Services_Detail,Provisioning_Ecosystem_Services,Provisioning_Ecosystem_Services_Detail,Health_and_Wellbeing,Health_and_Wellbeing_Detail,Social_and_Community_Outcomes,Social_and_Community_Outcomes_Detail,Economic_Outcomes,Economic_Outcomes_Detail
battisti2020a.pdf,[],"No relevant outcome information was identified. The study describes the physical and botanical characteristics of residential greenery (e.g., presence of bioswales, plant composition) but does not measure or analyze any regulating ecosystem services (such as stormwater management or air purification) as an outcome of these characteristics.",['Recreational'],"The study analyzes recreational outcomes of residential greenery quality. The Results and Discussion section notes that some green areas ""provide large places to spend pleasant time, especially during the summer."" It also reports that the field survey ""highlighted also conflicts within usage among local citizens. As an example, while some enjoy using the newly designed residential green space with their children, older neighbors complain about the noise generated."" This represents an analysis of recreational use and associated social conflicts as an outcome of the greenspace design and use.",[],"No relevant outcome information was identified. The study mentions the presence of gardens but does not analyze or measure any provisioning services, such as food production, as an outcome.",[],"No relevant outcome information was identified. Although the study is motivated by improving well-being and fostering ""health relevant ecosystem services,"" the Methods and Results sections do not include any analysis or measurement of physiological or psychological health outcomes for residents. The paper presents preliminary results focused on characterizing the greenspaces themselves.","['Use, engagement, recreation', 'Social interaction, cohesion']","The study analyzes use and social interaction as outcomes of residential greenspace. The field survey observed how residents use the spaces, noting that some areas ""provide large places to spend pleasant time."" This qualifies as ""Use, engagement, recreation."" The study also explicitly analyzed social conflict as an outcome, stating in the Results and Discussion that the ""field survey highlighted also conflicts within usage among local citizens. As an example, while some enjoy using the newly designed residential green space with their children, older neighbors complain about the noise generated."" This qualifies as ""Social interaction, cohesion.""",[],No relevant outcome information was identified. The study does not mention or analyze any economic outcomes related to residential greenspace quality in its Methods or Results sections.
banda2014.pdf,[],No qualifying information was identified. The study did not analyze or measure any regulating ecosystem services as outcomes of park quality.,['Recreational'],"Recreational use was analyzed as an outcome of park quality. The study's purpose was to ""examine the relationship between park characteristics and park use."" The Methods section describes using the System for Observing Play and Recreation in Communities (SOPARC) to document park use. The statistical analysis used logistic regression to ""determine whether the likelihood of observing use differed by target area condition, number of amenities in a target area, and number of incivilities in a target area."" The Results section reports that the ""number of amenities in a target area was positively associated with target area use for play equipment.""",[],No qualifying information was identified. The study did not analyze or measure any provisioning ecosystem services as outcomes of park quality.,[],"No qualifying information was identified. Although the study observed the physical activity levels of park users, these were characteristics of the park use being observed. The study did not analyze physiological or psychological health status (e.g., obesity rates, stress levels) as an outcome of park quality for a given population.","['Use, engagement, recreation']","Park use was the primary outcome analyzed as a consequence of park quality. The study's stated purpose was to ""examine the relationship between park characteristics and park use."" In the Methods section, the statistical analysis aimed to determine the ""Relationship Between Target Area Characteristics and Use."" Logistic regression models were used to assess whether the likelihood of observing use in a target area was associated with park quality characteristics, specifically ""target area condition, number of amenities in a target area, and number of incivilities in a target area."" The Results section presents findings from this analysis, such as ""The number of incivilities in a target area was positively associated with target area use.""",[],No qualifying information was identified. The study did not analyze or measure any economic outcomes of park quality.
chen2019b.pdf,[],No relevant outcome information was identified. The study does not analyze or measure any regulating ecosystem services as outcomes of park quality.,[],"No relevant outcome information was identified. The study measures aesthetic features as a component of park quality itself, not as an outcome resulting from park quality. Other cultural ecosystem services like recreation are mentioned conceptually but not measured as dependent outcomes.",[],No relevant outcome information was identified. The study does not analyze or measure any provisioning ecosystem services as outcomes of park quality.,[],"No relevant outcome information was identified. While the study mentions that park quality can affect health and physical activity in the introduction and discussion, it does not empirically measure or analyze any physiological or psychological health indicators as outcomes of park quality in its Methods or Results sections.","['Equity, environmental justice']","The study analyzes the equitable distribution of park quality as an outcome. It explicitly examines the correlation between park quality and 'Park Need,' which is an index of socio-demographic disadvantage. The Methods section describes using multiple linear regression to analyze the relationship between Park Access (which includes Park Quality) and Park Need (the dependent variable). The Results section (3.3) and Table 3 present a bivariate analysis of the correlations between 'Overall Park Quality' and the contributing variables of the 'Park Need Index,' finding significant negative correlations with poverty and renter rate. This directly assesses whether park quality is equitably distributed across communities with varying levels of need.",[],No relevant outcome information was identified. The study does not analyze or measure any economic outcomes of park quality.
fornal-pieniak2023.pdf,[],"No regulating ecosystem service outcomes were explicitly analyzed or measured as outcomes of park quality. The study's focus was on visitor preferences for cultural services and scenic qualities, not on biophysical processes like climate or flood regulation.","['Aesthetic', 'Educational', 'Recreational']","The study analyzed several cultural ecosystem service outcomes by measuring visitor preferences related to manor park qualities. Aesthetic outcomes were measured by surveying visitor preferences for different 'criteria of scenic qualities' on a 5-point scale. These criteria included statements about preserving the current or historic appearance of the park's forests (e.g., 'the current appearance of the forests should be preserved without conversion', 'the historic appearance of the forest should be maintained without the addition of recreational facilities'). Educational outcomes were analyzed by including 'learning about the history of manor parks' as a potential reason for visiting in the survey questionnaire. Recreational outcomes were analyzed by asking for 'Reasons for visiting manor parks,' which included 'relaxing in manor parks,' and by assessing preferences for the addition of 'recreational infrastructure features' and tourism-related services like 'the possibility of hiring a guide'.",[],"No provisioning ecosystem service outcomes were explicitly analyzed or measured as outcomes of park quality. The study did not investigate products obtained from the parks such as food, water, or fiber.",[],"No health and well-being outcomes were explicitly analyzed or measured as outcomes of park quality. While 'relaxing in manor parks' was a measured reason for visiting, the study did not measure psychological or physiological health indicators such as stress reduction or physical activity levels.","['Use, engagement, recreation', 'Equity, environmental justice', 'Stewardship, education']","The study analyzed several social and community outcomes. 'Use, engagement, recreation' was measured by analyzing the 'Reasons for visiting manor parks,' which included 'relaxing in manor parks,' 'interest in greenery in manor parks,' 'the interesting appearance of parks,' and 'places attractive to tourists.' 'Equity, environmental justice' was a central outcome, as the study's main hypotheses and statistical analyses (U Mann-Whitney test, Chi2 Pearson test) focused on how preferences for ecosystem services and scenic qualities differed across three per capita income groups. 'Stewardship, education' outcomes were analyzed by measuring visitor preferences for management options related to preserving the historical and natural character of the parks, as well as preferences for the 'involvement of the local community in running this type of place.' The educational aspect was also measured by asking if 'learning about the history of manor parks' was a reason for visiting.",['Economic impacts of recreation & tourism'],"The study analyzed visitor preferences for services that are directly related to the economic impacts of recreation and tourism. In the Methods section, the questionnaire included 'Selected criteria of ecosystem services' which were rated on a 5-point scale. These criteria included 'the possibility of buying souvenirs', 'the possibility of hiring a guide', 'tourist information in the media', 'the promotion of the manor park', and 'accommodation nearby or in the area'. The Results section analyzes how the importance of these tourism-related services varies as an outcome of visitor income."
ghanem2024.pdf,[],No relevant outcome information was identified. The study's purpose is to assess and compare the quality of greenspaces between low- and high-socio-economic status (SES) areas. It does not empirically measure or analyze any regulating ecosystem services as outcomes or consequences of the measured greenspace quality.,[],"No relevant outcome information was identified. While the study assesses 'Aesthetics' and 'Amenities and Facilities' (which relate to recreation) as components of greenspace quality, it does not measure cultural ecosystem services like aesthetic experience or recreational activity levels as outcomes resulting from that quality. The study's dependent variable is greenspace quality itself, not its consequences.",[],No relevant outcome information was identified. The study does not measure or analyze any provisioning ecosystem services as outcomes of greenspace quality in its Methods or Results sections.,[],"No relevant outcome information was identified. Although the introduction discusses the health benefits of greenspace, the study's empirical analysis in the Methods and Results sections does not measure or analyze any physiological or psychological health outcomes as consequences of greenspace quality.",[],"No relevant outcome information was identified. The study assesses 'Safety and Security' and 'Amenities and Facilities' as dimensions of greenspace quality, but it does not empirically measure social outcomes such as park use, engagement, or social cohesion as consequences of that quality. The analysis focuses on comparing quality scores between different socio-economic areas.",[],"No relevant outcome information was identified. The study does not measure or analyze any economic outcomes, such as property values or healthcare savings, as consequences of greenspace quality in its Methods or Results sections."
putra2021b.pdf,[],No regulating ecosystem service outcomes were explicitly analyzed or measured as outcomes of park or greenspace quality in the Methods or Results sections.,[],No cultural ecosystem service outcomes were explicitly analyzed or measured as outcomes of park or greenspace quality in the Methods or Results sections.,[],No provisioning ecosystem service outcomes were explicitly analyzed or measured as outcomes of park or greenspace quality in the Methods or Results sections.,[],"No health and well-being outcomes were explicitly analyzed or measured as outcomes of park or greenspace quality in the Methods or Results sections. While the introduction mentions that prosocial behavior is associated with health outcomes, the study itself measures prosocial behavior as the primary outcome, not subsequent health effects.","['Social interaction, cohesion', 'Equity, environmental justice']","The study analyzes two main social and community outcomes resulting from caregiver-perceived green space quality: 
1. Social interaction, cohesion: The study's primary outcome is child prosocial behaviour, a key component of social interaction. It was measured using the caregiver-reported prosocial scale from Goodman's Strengths and Difficulties Questionnaire (SDQ), which includes items like ""considerate of other people's feelings"" and ""share readily with other children"" (Methods, Section 2.2). The Results (Section 3.2, Table 3) show a multilevel linear regression analysis finding that children exposed to consistently very good quality green space had higher prosocial behaviour scores (β = 0.35; 95%CI = 0.23, 0.47) compared to those with low quality green space.
2. Equity, environmental justice: The study explicitly assesses whether green space quality can reduce socioeconomic inequalities in prosocial behaviour. Section 3.3 is titled ""Assessment of the potential role of quality green space perceived by caregivers in reducing prosocial behaviour related inequalities."" The results of multivariate models (Table 4) indicate that for children in the ""consistently in very good quality"" green space class, ""household economic position-related inequalities in child prosocial behaviour were less pronounced."" The study also analyzed how the association was modified by area disadvantage, finding it was stronger for children in more advantaged areas.",[],No economic outcomes were explicitly analyzed or measured as outcomes of park or greenspace quality in the Methods or Results sections.
stanley2022.pdf,[],"No relevant outcome information was identified. The study focuses on cultural ecosystem services based on user demands and does not explicitly analyze or measure any regulating ecosystem services (e.g., climate regulation, air purification) as outcomes of park or greenspace quality in its Methods or Results sections.","['Aesthetic', 'Recreational']","The study assesses UGS quality based on user demands for specific activities, which are primarily recreational and aesthetic in nature (e.g., 'walking', 'relaxing', 'observing nature'). The Methods section details how surveys were used to identify important UGS features that support these activities, including 'naturalness', 'tranquillity', 'aesthetics', and 'much greenery'. The UGS quality score is a weighted sum based on these features. The main outcome, analyzed in the Results section ""Supply of UGS to the elderly,"" is the calculated supply of high-quality UGS to the population. This serves as a direct measure of the provision of cultural ecosystem services (recreational opportunities and aesthetic benefits) as a function of UGS quality. For instance, the study reports that ""only 51.7% of elderly citizens are provided with at least one high-quality UGS site.""",[],"No relevant outcome information was identified. The study does not analyze or measure any provisioning ecosystem services (e.g., food, fresh water) as outcomes of park or greenspace quality.",[],"No relevant outcome information was identified. While the introduction discusses the health benefits of UGS, the study itself does not measure physiological or psychological health indicators as outcomes of park or greenspace quality in its Methods or Results sections. The analysis focuses on the supply of UGS, not its direct health impacts on the population.","['Equity, environmental justice']","The study's primary outcome is the assessment of the equitable supply of high-quality urban green spaces (UGS). The Methods section explicitly states that ""justice in the supply of UGS was determined by comparing the percentage provision to the elderly with that of the general population"" (p. 13). The analysis involves calculating UGS quality based on user demands, identifying high-quality UGS, and then intersecting their catchment areas with detailed population data. The Results section ""Supply of UGS to the elderly"" quantifies this outcome, reporting that ""only 51.7% of elderly citizens are provided with at least one high-quality UGS site"" compared to a 47.6% supply rate for the general population. The study uses this comparison to directly analyze supply equity as an outcome of considering UGS quality.",[],"No relevant outcome information was identified. The study does not analyze or measure any economic outcomes (e.g., property value, healthcare savings) resulting from park or greenspace quality."
baka2022.pdf,[],"No regulating ecosystem services were analyzed as outcomes of park or greenspace quality. The study measures characteristics like 'greenness' and 'biodiversity' as components of a greenspace quality index, but does not measure or analyze the actual ecosystem services (e.g., climate regulation, flood management) that result from these characteristics.",[],"No cultural ecosystem services were analyzed as outcomes of park or greenspace quality. The study assesses characteristics such as 'aesthetics', 'tranquillity', and the presence of 'facilities' as indicators of greenspace quality, but it does not measure the recreational use, aesthetic enjoyment, or other cultural benefits experienced by people as a result of that quality.",[],No provisioning ecosystem services were analyzed as outcomes of park or greenspace quality.,[],"No health and well-being outcomes were analyzed as outcomes of park or greenspace quality. While the paper discusses the importance of greenspace for health and wellbeing in the introduction and discussion, it does not empirically measure or analyze any physiological or psychological health outcomes for residents.","['Equity, environmental justice']","The study's central purpose is to assess equality in the distribution of quality greenspace. It explicitly analyzes greenspace quality as an outcome that varies by neighborhood socioeconomic status. The Methods section describes how greenspaces were scored on various quality characteristics (e.g., security, cleanness, aesthetics, biodiversity) and compared across neighborhood deprivation deciles (SIMD). The Results section reports statistically significant differences, concluding that 'across nearly all characteristics of greenspace, there is a statistically significant difference in assessed quality between the least deprived data zones and the most deprived, with greenspaces in more deprived areas scoring lower on the indicators of greenspace quality.' This is a direct analysis of the equitable distribution of greenspace quality.",[],No economic outcomes were analyzed as outcomes of park or greenspace quality.
sander2017.pdf,[],"No relevant outcome information was identified. The study mentions regulating services such as regulating flooding and air quality conceptually in the introduction, but does not measure or analyze any regulating ecosystem services as outcomes of greenspace quality in the Methods or Results sections.",[],"No relevant outcome information was identified. While the study discusses recreation and relaxation as potential mechanisms linking greenspace to health, it does not measure recreational activity or other cultural ecosystem services as outcomes of greenspace quality. The measured outcome is a health metric (BMI).",[],No relevant outcome information was identified. The study does not mention or analyze any provisioning ecosystem services.,['Physiological health'],"The study analyzes Body Mass Index (BMI), an indicator of physiological health related to overweight and obesity, as the primary outcome of urban greenspace characteristics. The Methods section describes how BMI was calculated from driver's license and identification card data and then aggregated to find the ""average block group male and female BMI"" for four different age groups (Section 2.1). The study then uses regression models to ""identify relationships among independent variables and BMI"" (Section 2.4). The independent variables represent various aspects of greenspace quality, including greenspace type (recreational park, cemetery, conservation), connectivity, and composition (e.g., percentage covered by water, forest, impervious surfaces, grass, and canopy cover). The Results section (Tables 2 and 3) reports the statistical associations between these greenspace attributes and mean BMI. For example, the study finds that ""Recreational park percentage was significantly negatively related to mean BMI for only middle-adult females"" and ""Greenspace impervious surface was significantly and negatively related to BMI for middle-adult females... and males"".",[],No relevant outcome information was identified. The study does not measure or analyze social or community outcomes.,[],No relevant outcome information was identified. The study does not measure or analyze economic outcomes.
feng2017a.pdf,[],No regulating ecosystem services were explicitly analyzed or measured as outcomes of park or greenspace quality in the Methods or Results sections. The study focused on child well-being as the primary outcome.,[],"No cultural ecosystem services were explicitly analyzed or measured as outcomes of park or greenspace quality in the Methods or Results sections. The study's outcomes were focused on child well-being, not on cultural services like recreation or aesthetic appreciation.",[],No provisioning ecosystem services were explicitly analyzed or measured as outcomes of park or greenspace quality in the Methods or Results sections.,['Psychological health'],"The study analyzed child well-being as an outcome of residential green space quality. Psychological health was measured using Goodman's 25-item Strengths and Difficulties Questionnaire (SDQ), which the Methods section describes as a 'behavioral screening tool of well-being' that 'provides coverage of children's behavior, emotions, and peer relations'. Three specific outcome variables were examined: the 'Total Difficulties Score (TDS)', an 'internalizing subscale' (derived by summing the emotional and peer symptoms scales), and an 'externalizing subscale' (derived by summing the conduct problems and hyperactivity scales). The Results section (Table 3) presents multilevel linear regression models showing the association between parent-reported green space quality ('Quality parks') and these three psychological well-being outcomes.",[],"No social and community outcomes were explicitly analyzed or measured as outcomes of park or greenspace quality in the Methods or Results sections. While the well-being measure (SDQ) includes a 'peer relations' component, the study frames and analyzes this as a dimension of individual child psychological well-being rather than a community-level social outcome.",[],No economic outcomes were explicitly analyzed or measured as outcomes of park or greenspace quality in the Methods or Results sections.
